{
  "schema_version": 1,
  "stage": "qwen",
  "run_id": "11111111-1111-4111-8111-111111111111",
  "invocation_id": "22222222-2222-4222-8222-222222222222",
  "ok": true,
  "model": {
    "id": "nvidia/Qwen3-8B-NVFP4",
    "revision": "synthetic-fixture-revision",
    "precision": "synthetic",
    "runtime": "synthetic-fixture"
  },
  "data": {
    "prompt": "Editorial illustration of neighbors planting trees beside a library."
  },
  "usage": {
    "input_tokens": 45,
    "output_tokens": 14,
    "total_tokens": 59
  },
  "timings": {
    "inference_ms": 125.0
  },
  "counters": {
    "inference_attempts": 1,
    "inference_retries": 0,
    "dependency_retries": 0
  },
  "error": null
}
